{
  "schema": "panlabs-aws-diagrams/model@1",
  "id": "elk-no-layer",
  "title": "A mesma lacuna, no caminho do ELK — aqui ela avisa",
  "subtitle": "Uma AZ só, então não há grade. A subnet sem camada não bloqueia: o ELK tem o grafo para ordenar, e o motor conta o que não soube.",
  "view": "technical",
  "genre": "T1",

  "nodes": [
    { "id": "cloud", "kind": "cloud", "label": "AWS Cloud" },
    { "id": "region", "kind": "region", "label": "eu-west-1", "inside": "cloud" },
    { "id": "vpc", "kind": "vpc", "label": "VPC de produção · 10.80.0.0/16", "cidr": "10.80.0.0/16", "inside": "region" },

    { "id": "app", "kind": "subnet", "label": "App subnet", "access": "private", "az": "eu-west-1a", "inside": "vpc" },
    { "id": "res", "kind": "subnet", "label": "Reserved subnet", "access": "private", "az": "eu-west-1a", "cidr": "10.80.20.0/24", "inside": "vpc" },

    { "id": "ecs", "kind": "service", "service": "ecs", "label": "API", "inside": "app" },
    { "id": "vpce", "kind": "service", "service": "endpoints", "label": "VPC endpoint", "inside": "app" }
  ],

  "edges": [
    { "from": "ecs", "to": "vpce", "label": "https", "protocol": "https" }
  ],

  "notes": [
    { "text": "A 'Reserved subnet' está vazia igual à do modelo recusado — e aqui o motor desenha assim mesmo. A assimetria é a decisão do #22: a grade EXIGE o fato porque lá a ordem das linhas é o desenho; o ELK avisa, porque lá a camada só desempata irmãos que nenhuma aresta ordena.", "origin": "legend" }
  ]
}
