{
  "schema": "panlabs-aws-diagrams/model@1",
  "id": "analytics-pipeline",
  "title": "Telemetria de loja · pipeline analítico",
  "subtitle": "Vista técnica T2 · cadeia de serviços gerenciados fora de VPC — nenhuma sub-rede, nenhum andar de rede a ler",
  "view": "technical",
  "genre": "T2",

  "nodes": [
    { "id": "loja", "kind": "actor", "service": "users", "label": "Lojas",
      "qualifier": "300 pontos de venda" },

    { "id": "cloud", "kind": "cloud", "label": "AWS Cloud" },
    { "id": "region", "kind": "region", "label": "sa-east-1", "inside": "cloud" },

    { "id": "ingestao", "kind": "service", "service": "kinesis data firehose", "label": "Data Firehose", "inside": "region",
      "qualifier": "recebe e entrega em lotes de 5 min" },
    { "id": "bruto", "kind": "service", "service": "s3", "label": "Zona bruta", "inside": "region",
      "qualifier": "particionado por dia e loja" },
    { "id": "catalog", "kind": "service", "service": "glue", "label": "Glue", "inside": "region",
      "qualifier": "cataloga e transforma" },
    { "id": "curado", "kind": "service", "service": "s3", "label": "Zona curada", "inside": "region",
      "qualifier": "colunar, pronto para consulta" },
    { "id": "consulta", "kind": "service", "service": "athena", "label": "Athena", "inside": "region",
      "qualifier": "SQL sobre a zona curada" },
    { "id": "painel", "kind": "service", "service": "quicksight", "label": "QuickSight", "inside": "region",
      "qualifier": "painel de vendas por região" }
  ],

  "edges": [
    { "from": "loja", "to": "ingestao", "label": "envia telemetria", "protocol": "https", "order": 1 },
    { "from": "ingestao", "to": "bruto", "label": "entrega em lote", "order": 2 },
    { "from": "catalog", "to": "bruto", "label": "lê e cataloga", "data": "back", "order": 3 },
    { "from": "catalog", "to": "curado", "label": "grava colunar", "order": 4 },
    { "from": "consulta", "to": "curado", "label": "consulta", "protocol": "sql", "data": "back", "order": 5 },
    { "from": "painel", "to": "consulta", "label": "renderiza", "data": "back", "order": 6 }
  ],

  "notes": [
    { "id": "nota-sem-rede",
      "text": "Nenhum serviço desta cadeia vive em sub-rede — é o gênero T2 em estado puro, e o caminho do ELK layouta a hierarquia inteira numa passada. Não há andar de rede a ordenar porque não há sub-rede.",
      "origin": "legend" }
  ],

  "dossier": {
    "_comentario": "T2 do corpus do #26. Existe para provar que o gênero pipeline de dados atravessa o motor sem passar por VPC nenhuma, e para dar à revisão de lacunas um caso onde a regra de sub-rede pública TEM de ficar muda.",
    "axes": {
      "E1": "gerenciado sem compute próprio",
      "E2": "lote agendado, com entrega por janela",
      "E3": "objeto / data lake com camada analítica",
      "E4": "sem exposição de rede própria — tudo por endpoint gerenciado",
      "E5": "fronteira única: plataforma de dados"
    }
  }
}
