{
  "schema": "panlabs-aws-diagrams/model@1",
  "id": "lying-band",
  "title": "A faixa que mentia — o corpo de prova da degradação do #168",
  "subtitle": "Até o #168, este modelo GERAVA um desenho que afirmava um atributo que o modelo nega, e só --gate veracidade recusava. Agora o caminho ELK degrada a faixa para rótulo em vez de desenhar a caixa que mente — a régua do #31 estendida ao ELK — e o modelo passa limpo em qualquer nível de portão.",
  "view": "technical",

  "nodes": [
    { "id": "cloud", "kind": "cloud", "label": "AWS Cloud" },
    { "id": "vpc", "kind": "vpc", "label": "VPC de produção · 10.0.0.0/16", "cidr": "10.0.0.0/16", "inside": "cloud" },
    { "id": "sub", "kind": "subnet", "label": "App subnet", "access": "private", "az": "us-east-1a", "inside": "vpc" },

    { "id": "n1", "kind": "service", "service": "ec2", "label": "Nó que escala", "inside": "sub" },
    { "id": "n2", "kind": "service", "service": "rds", "label": "Base que NÃO escala", "inside": "sub" },
    { "id": "n3", "kind": "service", "service": "ec2", "label": "Outro nó que escala", "inside": "sub" }
  ],

  "edges": [
    { "id": "e12", "from": "n1", "to": "n2", "label": "grava" },
    { "id": "e23", "from": "n2", "to": "n3", "label": "replica" }
  ],

  "bands": [
    { "id": "escala", "kind": "generic", "label": "Escala junto", "members": ["n1", "n3"] }
  ],

  "notes": [
    { "id": "n-porque", "origin": "assumption", "text": "A faixa declara DOIS membros e o layout põe um terceiro entre eles. A caixa da faixa é a UNIÃO dos membros (o agente diz QUEM, o motor calcula ONDE) — antes do #168, o não-membro caía dentro dela e o desenho passava a afirmar dele um atributo que o modelo não declara (F1, tolerância zero). Agora o `elkPlan` mede a mesma união, vê que ela abraça `n2`, e degrada a faixa para rótulo solto antes de desenhar a caixa — não há mais caixa para F1 medir." }
  ]
}
