{
  "schema": "panlabs-aws-diagrams/model@1",
  "id": "quorum-3-az",
  "title": "Streaming · quórum de brokers em três zonas",
  "subtitle": "Vista técnica T1 · réplica entre TODOS os pares de zona — o leque que não cabe numa reta",
  "view": "technical",
  "genre": "T1",

  "nodes": [
    { "id": "cloud", "kind": "cloud", "label": "AWS Cloud" },
    { "id": "vpc", "kind": "vpc", "label": "VPC de dados · 10.4.0.0/16", "cidr": "10.4.0.0/16", "inside": "cloud" },

    { "id": "app-a", "kind": "subnet", "label": "App subnet", "access": "private", "az": "us-east-1a", "cidr": "10.4.1.0/24", "inside": "vpc" },
    { "id": "app-b", "kind": "subnet", "label": "App subnet", "access": "private", "az": "us-east-1b", "cidr": "10.4.2.0/24", "inside": "vpc" },
    { "id": "app-c", "kind": "subnet", "label": "App subnet", "access": "private", "az": "us-east-1c", "cidr": "10.4.3.0/24", "inside": "vpc" },

    { "id": "broker-a", "kind": "service", "service": "msk", "label": "Broker 1", "inside": "app-a",
      "qualifier": "líder de um terço das partições" },
    { "id": "broker-b", "kind": "service", "service": "msk", "label": "Broker 2", "inside": "app-b",
      "qualifier": "líder de um terço das partições" },
    { "id": "broker-c", "kind": "service", "service": "msk", "label": "Broker 3", "inside": "app-c",
      "qualifier": "líder de um terço das partições" }
  ],

  "edges": [
    { "from": "broker-b", "to": "broker-a", "label": "busca réplica", "protocol": "kafka", "data": "back" },
    { "from": "broker-c", "to": "broker-a", "label": "busca réplica", "protocol": "kafka", "data": "back" },
    { "from": "broker-a", "to": "broker-b", "label": "busca réplica", "protocol": "kafka", "data": "back" },
    { "from": "broker-c", "to": "broker-b", "label": "busca réplica", "protocol": "kafka", "data": "back" },
    { "from": "broker-a", "to": "broker-c", "label": "busca réplica", "protocol": "kafka", "data": "back" },
    { "from": "broker-b", "to": "broker-c", "label": "busca réplica", "protocol": "kafka", "data": "back" }
  ],

  "notes": [
    { "id": "nota-leque",
      "text": "Fator de réplica 3 sobre três zonas: cada broker fala com os outros dois, então o grafo de travessia entre zonas é um TRIÂNGULO. Nenhuma ordem de raia põe os três pares lado a lado — quaisquer que sejam as posições, o par das pontas fica a distância 2 e a aresta dele corta a faixa do meio. É o caso que o #21 chamou de fallback, e o gatilho dele é medido, não declarado aqui.",
      "origin": "legend" }
  ],

  "dossier": {
    "_comentario": "O caso de DENSIDADE do corpus do #26 — não é um gênero, é um eixo. Existe para que o gatilho da vista de zona de referência (#21) tenha onde disparar; o par de controle que NÃO dispara é o web-flow-3-az, com as mesmas três zonas e um grafo de travessia que cabe numa reta.",
    "axes": {
      "E1": "gerenciado sem compute próprio",
      "E2": "assíncrono por evento",
      "E3": "log particionado, replicado por quórum",
      "E4": "privado, sem ponto de entrada nesta vista",
      "E5": "fronteira única: plataforma de streaming"
    }
  }
}
